{
 "meta": {
  "schema": "optiondesk/chain_snapshot/v1",
  "generated_utc": "2026-09-08T22:15:38+00:00",
  "tool": "optiondesk chain",
  "shell_version": "0.3.0",
  "engine_version": "0.3.0",
  "provider_used": "user snapshot",
  "degraded": false,
  "degraded_reason": null,
  "notes": [
   "Synthetic teaching inputs. No observed quotes, holdings, or price history. Not market-performance evidence.",
   "row 1: calculated mid from bid and ask",
   "row 2: calculated mid from bid and ask",
   "row 3: calculated mid from bid and ask",
   "row 4: calculated mid from bid and ask",
   "row 5: calculated mid from bid and ask",
   "row 6: calculated mid from bid and ask",
   "row 7: calculated mid from bid and ask",
   "row 8: calculated mid from bid and ask",
   "row 9: calculated mid from bid and ask",
   "row 10: calculated mid from bid and ask",
   "row 11: calculated mid from bid and ask",
   "row 12: calculated mid from bid and ask",
   "row 13: calculated mid from bid and ask",
   "row 14: calculated mid from bid and ask",
   "row 15: calculated mid from bid and ask",
   "row 16: calculated mid from bid and ask",
   "row 17: calculated mid from bid and ask",
   "row 18: calculated mid from bid and ask",
   "row 19: calculated mid from bid and ask",
   "row 20: calculated mid from bid and ask",
   "row 21: calculated mid from bid and ask",
   "row 22: calculated mid from bid and ask",
   "row 23: calculated mid from bid and ask",
   "row 24: calculated mid from bid and ask",
   "row 25: calculated mid from bid and ask",
   "row 26: calculated mid from bid and ask",
   "row 27: calculated mid from bid and ask",
   "row 28: calculated mid from bid and ask",
   "row 29: calculated mid from bid and ask",
   "row 30: calculated mid from bid and ask",
   "row 31: calculated mid from bid and ask",
   "row 32: calculated mid from bid and ask",
   "row 33: calculated mid from bid and ask",
   "row 34: calculated mid from bid and ask",
   "row 35: calculated mid from bid and ask",
   "row 36: calculated mid from bid and ask",
   "row 37: calculated mid from bid and ask",
   "row 38: calculated mid from bid and ask",
   "row 39: calculated mid from bid and ask",
   "row 40: calculated mid from bid and ask",
   "row 41: calculated mid from bid and ask",
   "row 42: calculated mid from bid and ask",
   "row 43: calculated mid from bid and ask",
   "row 44: calculated mid from bid and ask",
   "row 45: calculated mid from bid and ask",
   "row 46: calculated mid from bid and ask",
   "row 47: calculated mid from bid and ask",
   "row 48: calculated mid from bid and ask",
   "row 49: calculated mid from bid and ask",
   "row 50: calculated mid from bid and ask",
   "row 51: calculated mid from bid and ask",
   "row 52: calculated mid from bid and ask",
   "row 53: calculated mid from bid and ask",
   "row 54: calculated mid from bid and ask",
   "row 55: calculated mid from bid and ask",
   "row 56: calculated mid from bid and ask",
   "row 57: calculated mid from bid and ask",
   "row 58: calculated mid from bid and ask",
   "row 59: calculated mid from bid and ask",
   "row 60: calculated mid from bid and ask",
   "row 61: calculated mid from bid and ask",
   "row 62: calculated mid from bid and ask"
  ],
  "inputs": {
   "symbol": "SYNTH",
   "expiry": null,
   "rate_source": "user_file",
   "dividend_yield": 0.01,
   "user_supplied": true,
   "data_source": "Synthetic teaching sample; authored inputs, model prices, no market observations",
   "rights_asserted": true
  },
  "disclaimer": "Research output, not investment advice, and not a recommendation or solicitation. Option premiums here are theoretical model values, not quotes and not achievable fills. Market data is third-party, may be delayed or wrong, and its redistribution is governed by the provider's terms. No warranty. See DISCLAIMER.md.",
  "license": "Produced by optiondesk under the PolyForm Noncommercial License 1.0.0. Noncommercial use is permitted; commercial use requires a separate written agreement with the copyright holder. See LICENSE and LICENSES.md."
 },
 "underlying": "SYNTH",
 "spot": 100.0,
 "spot_asof": "2026-09-08T00:00:00Z",
 "risk_free_rate": 0.04,
 "dividend_yield": 0.01,
 "dividend_yield_source": "user_file",
 "dividend_yield_note": null,
 "expiry": "2026-11-07",
 "days_to_expiry": 60.0,
 "contracts": [
  {
   "symbol": "SYNTHC70",
   "type": "call",
   "strike": 70.0,
   "bid": 29.399384,
   "ask": 31.217903,
   "mid": 30.308643500000002,
   "last": null,
   "volume": 66,
   "open_interest": 214,
   "iv": 0.3365,
   "iv_source": "provider",
   "iv_provider": 0.3365,
   "mid_source": "quote"
  },
  {
   "symbol": "SYNTHP70",
   "type": "put",
   "strike": 70.0,
   "bid": 0.013704,
   "ask": 0.014552,
   "mid": 0.014128,
   "last": null,
   "volume": 66,
   "open_interest": 260,
   "iv": 0.3365,
   "iv_source": "provider",
   "iv_provider": 0.3365,
   "mid_source": "quote"
  },
  {
   "symbol": "SYNTHC72",
   "type": "call",
   "strike": 72.0,
   "bid": 27.480545,
   "ask": 29.180372,
   "mid": 28.3304585,
   "last": null,
   "volume": 67,
   "open_interest": 221,
   "iv": 0.32944,
   "iv_source": "provider",
   "iv_provider": 0.32944,
   "mid_source": "quote"
  },
  {
   "symbol": "SYNTHP72",
   "type": "put",
   "strike": 72.0,
   "bid": 0.02215,
   "ask": 0.023521,
   "mid": 0.0228355,
   "last": null,
   "volume": 67,
   "open_interest": 273,
   "iv": 0.32944,
   "iv_source": "provider",
   "iv_provider": 0.32944,
   "mid_source": "quote"
  },
  {
   "symbol": "SYNTHC74",
   "type": "call",
   "strike": 74.0,
   "bid": 25.566494,
   "ask": 27.147927,
   "mid": 26.3572105,
   "last": null,
   "volume": 68,
   "open_interest": 229,
   "iv": 0.32266,
   "iv_source": "provider",
   "iv_provider": 0.32266,
   "mid_source": "quote"
  },
  {
   "symbol": "SYNTHP74",
   "type": "put",
   "strike": 74.0,
   "bid": 0.035385,
   "ask": 0.037574,
   "mid": 0.0364795,
   "last": null,
   "volume": 68,
   "open_interest": 290,
   "iv": 0.32266,
   "iv_source": "provider",
   "iv_provider": 0.32266,
   "mid_source": "quote"
  },
  {
   "symbol": "SYNTHC76",
   "type": "call",
   "strike": 76.0,
   "bid": 23.659658,
   "ask": 25.123142,
   "mid": 24.3914,
   "last": null,
   "volume": 70,
   "open_interest": 237,
   "iv": 0.31616,
   "iv_source": "provider",
   "iv_provider": 0.31616,
   "mid_source": "quote"
  },
  {
   "symbol": "SYNTHP76",
   "type": "put",
   "strike": 76.0,
   "bid": 0.055835,
   "ask": 0.059289,
   "mid": 0.057562,
   "last": null,
   "volume": 70,
   "open_interest": 310,
   "iv": 0.31616,
   "iv_source": "provider",
   "iv_provider": 0.31616,
   "mid_source": "quote"
  },
  {
   "symbol": "SYNTHC78",
   "type": "call",
   "strike": 78.0,
   "bid": 21.763497,
   "ask": 23.109693,
   "mid": 22.436595,
   "last": null,
   "volume": 71,
   "open_interest": 248,
   "iv": 0.30994,
   "iv_source": "provider",
   "iv_provider": 0.30994,
   "mid_source": "quote"
  },
  {
   "symbol": "SYNTHP78",
   "type": "put",
   "strike": 78.0,
   "bid": 0.08696,
   "ask": 0.092339,
   "mid": 0.0896495,
   "last": null,
   "volume": 71,
   "open_interest": 335,
   "iv": 0.30994,
   "iv_source": "provider",
   "iv_provider": 0.30994,
   "mid_source": "quote"
  },
  {
   "symbol": "SYNTHC80",
   "type": "call",
   "strike": 80.0,
   "bid": 19.882823,
   "ask": 21.112689,
   "mid": 20.497756,
   "last": null,
   "volume": 73,
   "open_interest": 260,
   "iv": 0.304,
   "iv_source": "provider",
   "iv_provider": 0.304,
   "mid_source": "quote"
  },
  {
   "symbol": "SYNTHP80",
   "type": "put",
   "strike": 80.0,
   "bid": 0.133572,
   "ask": 0.141834,
   "mid": 0.137703,
   "last": null,
   "volume": 73,
   "open_interest": 366,
   "iv": 0.304,
   "iv_source": "provider",
   "iv_provider": 0.304,
   "mid_source": "quote"
  },
  {
   "symbol": "SYNTHC82",
   "type": "call",
   "strike": 82.0,
   "bid": 18.024137,
   "ask": 19.139032,
   "mid": 18.581584499999998,
   "last": null,
   "volume": 76,
   "open_interest": 273,
   "iv": 0.29834,
   "iv_source": "provider",
   "iv_provider": 0.29834,
   "mid_source": "quote"
  },
  {
   "symbol": "SYNTHP82",
   "type": "put",
   "strike": 82.0,
   "bid": 0.202171,
   "ask": 0.214677,
   "mid": 0.208424,
   "last": null,
   "volume": 76,
   "open_interest": 407,
   "iv": 0.29834,
   "iv_source": "provider",
   "iv_provider": 0.29834,
   "mid_source": "quote"
  },
  {
   "symbol": "SYNTHC84",
   "type": "call",
   "strike": 84.0,
   "bid": 16.195946,
   "ask": 17.197757,
   "mid": 16.6968515,
   "last": null,
   "volume": 79,
   "open_interest": 290,
   "iv": 0.29296,
   "iv_source": "provider",
   "iv_provider": 0.29296,
   "mid_source": "quote"
  },
  {
   "symbol": "SYNTHP84",
   "type": "put",
   "strike": 84.0,
   "bid": 0.301266,
   "ask": 0.319901,
   "mid": 0.3105835,
   "last": null,
   "volume": 79,
   "open_interest": 463,
   "iv": 0.29296,
   "iv_source": "provider",
   "iv_provider": 0.29296,
   "mid_source": "quote"
  },
  {
   "symbol": "SYNTHC86",
   "type": "call",
   "strike": 86.0,
   "bid": 14.40899,
   "ask": 15.300268,
   "mid": 14.854629,
   "last": null,
   "volume": 83,
   "open_interest": 310,
   "iv": 0.28786,
   "iv_source": "provider",
   "iv_provider": 0.28786,
   "mid_source": "quote"
  },
  {
   "symbol": "SYNTHP86",
   "type": "put",
   "strike": 86.0,
   "bid": 0.441595,
   "ask": 0.468911,
   "mid": 0.455253,
   "last": null,
   "volume": 83,
   "open_interest": 544,
   "iv": 0.28786,
   "iv_source": "provider",
   "iv_provider": 0.28786,
   "mid_source": "quote"
  },
  {
   "symbol": "SYNTHC88",
   "type": "call",
   "strike": 88.0,
   "bid": 12.676287,
   "ask": 13.460387,
   "mid": 13.068337,
   "last": null,
   "volume": 88,
   "open_interest": 335,
   "iv": 0.28304,
   "iv_source": "provider",
   "iv_provider": 0.28304,
   "mid_source": "quote"
  },
  {
   "symbol": "SYNTHP88",
   "type": "put",
   "strike": 88.0,
   "bid": 0.636178,
   "ask": 0.67553,